TexteA,TextB,TextAPT,TextBPT,TFIDF,Jaccard_Distance,Levenshtein_Distance,NGram-Similarity,EXPECTED,RESULT,Score Keywords,Score entities
"Brendan Doherty says U.S. Rep. David Cicilline, when he was a state representative, opposed mandatory sentences for people convicted of domestic violence and child abuse",U.S. Rep. David Cicilline says Republican opponent Brendan Doherty wants to repeal Obamacare and increase drug prices for seniors,brendan doherty us rep david cicilline state representative opposed mandatory sentences people convicted domestic violence child abuse ,us rep david cicilline republican opponent brendan doherty wants repeal obamacare increase drug prices seniors ,0.23,0.23076923076923078,88,0.17647058823529413,N,N,0.0787446034559451,0.40735260428856745
Mary Burke says Wisconsin's job agency has unspent funds,Scott Walker says 2013 job growth in Wisconsin was best since 1990s,mary burke wisconsins job agency unspent funds ,scott walker two thousand thirteen job growth wisconsin best since 1990s ,0.06,0.058823529411764705,51,0.0,N,N,0.0,0.494589223205613
NC Sen. Richard Burr says nuclear deal 'will arm Iran',"Iran nuclear deal was Hillary Clinton's, and it 'lined the pockets' of Iran with Americans' money?",nc sen richard burr nuclear deal arm iran ,iran nuclear deal hillary clintons lined pockets iran americans money ,0.26,0.21428571428571427,49,0.0,ST,N,0.0,0.0
Sen. Sheldon Whitehouse of R.I. says growth of SuperPACs led to eightfold increase in negative campaign ads,"U.S. Sen. Sheldon Whitehouse says proposal would keep Social Security, solvent through 2033, alive for 75 additional years",sen sheldon whitehouse ri growth superpacs led eightfold increase negative campaign ads ,us sen sheldon whitehouse proposal would keep social security solvent 2033 alive seventyfive additional years ,0.13,0.125,61,0.06666666666666667,N,N,0.2523342014336961,0.13797394741164487
DNC says presidential candidates usually release tax returns but Romney won't,Tim Kaine correctly notes Richard Nixon released tax returns despite audit,dnc presidential candidates usually release tax returns romney wont ,tim kaine correctly notes richard nixon released tax returns despite audit ,0.11,0.1111111111111111,44,0.0,N,N,0.0,0.0
Brendan Doherty says most of the David Cicilline campaign is funded by big political action committees,U.S. Rep. David Cicilline says the United States has been growing jobs for 24 months,brendan doherty david cicilline campaign funded big political action committees ,us rep david cicilline united states growing jobs twentyfour months ,0.11,0.1111111111111111,51,0.0,N,N,0.1506401849870651,0.09554861307050319
Gov. Rick Perry says Texas added more jobs in 2010 than any other state,Bill White says Texas has a higher unemployment rate than neighboring states,gov rick perry texas added jobs two thousand ten state ,bill white texas higher unemployment rate neighboring states ,0.06,0.058823529411764705,43,0.0,N,N,0.0,0.0991575972469027
"Self-defense deaths in Florida have increased dramatically since 'stand your ground' became law in 2005, lawmaker claims",Florida sheriff says state association 'unequivocally' supports the ‘stand your ground’ law,selfdefense deaths florida increased dramatically since stand ground became law 2005 lawmaker claims ,florida sheriff state association unequivocally supports stand ground law ,0.23,0.2222222222222222,73,0.1,N,N,0.0,0.1917474996492085
U.S. Rep. David Cicilline says women earn only 77 percent of what men earn in the same job,U.S. Rep. David Cicilline says Republican opponent Brendan Doherty wants to repeal Obamacare and increase drug prices for seniors,us rep david cicilline women earn seventyseven percent men earn job ,us rep david cicilline republican opponent brendan doherty wants repeal obamacare increase drug prices seniors ,0.17,0.19047619047619047,66,0.25,N,N,0.26951761324603224,0.16410936084323513
"Democrats target Tom Ganley, citing Better Business Bureau ratings and complaints",Rep. Betty Sutton cries 'voter beware' in ad against GOP opponent Tom Ganley,democrats target tom ganley citing better business bureau ratings complaints ,rep betty sutton cries voter beware ad gop opponent tom ganley ,0.11,0.10526315789473684,53,0.0,N,N,0.23790309463326234,0.34913747144188384
Republican Bernard Jackvony says Democrat David Cicilline is the fifth most liberal Representative in Congress,"U.S. Rep. David Cicilline says he voted for tougher laws against child abusers, domestic abusers, when he was a Rhode Island state representative",republican bernard jackvony democrat david cicilline fifth liberal representative congress ,us rep david cicilline voted tougher laws child abusers domestic abusers rhode island state representative ,0.13,0.14285714285714285,81,0.0,N,N,0.11521554337793123,0.10655561428382405
Has Scott Walker changed his view on ethanol mandates?,Did Scott Walker say forced ultrasounds to get an abortion are 'a cool thing'?,scott walker changed view ethanol mandates ,scott walker forced ultrasounds get abortion cool thing ,0.17,0.16666666666666666,33,0.0,N,N,0.0,0.5812161092958792
U.S. Sen. Sheldon Whitehouse says that Rhode Island has the second-most heavily deployed National Guard in the nation.,U.S. Senate candidate Barry Hinckley says Sen. Sheldon Whitehouse will have added nearly $8 trillion to the national debt during his first term,us sen sheldon whitehouse rhode island secondmost heavily deployed national guard nation ,us senate candidate barry hinckley sen sheldon whitehouse added nearly 8 trillion national debt first term ,0.23,0.21739130434782608,71,0.0625,N,N,0.0,0.04113547275809673
Scott Walker disavows support for path to citizenship,"With 2016 on the horizon, Scott Walker asserts his appeal among Republicans and independents",scott walker disavows support path citizenship ,two thousand sixteen horizon scott walker asserts appeal among republicans independents ,0.14,0.13333333333333333,64,0.0,N,N,0.26055567105626243,0.521388223818929
Did Scott Walker flip-flop on how budget shortfalls are measured??,"With Scott Walker's $300 million budget cut looming, UW-Madison says it doesn't have reserves to tap",scott walker flipflop budget shortfalls measured ,scott walkers 300 million budget cut looming uwmadison doesnt reserves tap ,0.14,0.13333333333333333,43,0.0,N,N,0.0,0.6498913515523022
Ken Block knocks Republican Allan Fung's donations to controversial Democrats,Allan Fung claims Wall Street investors went bust on 38 Studios deal,ken block knocks republican allan fungs donations controversial democrats ,allan fung claims wall street investors went bust thirtyeight studios deal ,0.05,0.05263157894736842,63,0.0,N,N,0.09349477497536716,0.020726895444525786
Rick Perry says Barack Obama is a socialist,Roger Williams says Obama is a socialist,rick perry barack obama socialist ,roger williams obama socialist ,0.29,0.2857142857142857,13,0.4,E*,N,0.0,0.25510493425475234
Columnist Gail Collins blames Gov. Scott Walker for teacher's lost job,"Scott Walker: UW tuition will be lower than ""just about any other campus""",columnist gail collins blames gov scott walker teachers lost job ,scott walker uw tuition lower campus ,0.15,0.14285714285714285,49,0.0,N,N,0.0,0.4715980308251274
"Jane Norton's Public Health and Environment Department had some funding increase, some funding decrease","Ken Buck's budget increased, but commissioners said it was justified",jane nortons public health environment department funding increase funding decrease ,ken bucks budget increased commissioners justified ,0.0,0.0,61,0.0,N,N,0.11521554337793123,0.3457343547939601
Marco Rubio says Iran deal means we have to help defend Iran from Israel or other allies,"Deal puts Iran's nuclear program under lock, key and camera 24/7, says Rep. Don Beyer",marco rubio iran deal means help defend iran israel allies ,deal puts irans nuclear program lock key camera 247 rep beyer ,0.05,0.05263157894736842,45,0.0,N,N,0.0,0.11521554337793123
Nancy Pelosi says more jobs created in Obama's first year than eight years of George W. Bush,Nancy Pelosi says jobs increased faster in 2010 than in eight years under Bush,nancy pelosi jobs created obamas first year eight years george w bush ,nancy pelosi jobs increased faster two thousand ten eight years bush ,0.38,0.35294117647058826,32,0.08333333333333333,ST,ST,0.33609692727625756,0.09915759724690268
Florida Democrats say Rick Scott cut more jobs than created in 2012,Rick Scott correct that Florida created 1 million jobs on his watch,florida democrats rick scott cut jobs created two thousand twelve ,rick scott correct florida created one million jobs watch ,0.36,0.35714285714285715,47,0.0,N,N,0.0,0.10011031656225383
"Scott Walker says ""best two-year job growth"" came during his tenure",Scott Walker says 2013 job growth in Wisconsin was best since 1990s,scott walker best twoyear job growth came tenure ,scott walker two thousand thirteen job growth wisconsin best since 1990s ,0.37,0.35714285714285715,39,0.1111111111111111,ST,ST,1.0000000000000002,0.3446421410380548
DNC ad says Mitt Romney flip-flopped on Obama stimulus,DNC ad accuses Mitt Romney of flip-flopping on assault-weapons ban,dnc ad mitt romney flipflopped obama stimulus ,dnc ad accuses mitt romney flipflopping assaultweapons ban ,0.37,0.36363636363636365,27,0.0,N,ST,0.6694188517266485,0.13477398542330465
"Michele Bachmann says Newt Gingrich backed individual mandate in 1993, 2011",Rick Santorum calls Newt Gingrich a longtime supporter of insurance mandate,michele bachmann newt gingrich backed individual mandate 1993 two thousand eleven ,rick santorum calls newt gingrich longtime supporter insurance mandate ,0.18,0.17647058823529413,57,0.0,ST,N,0.1707761131901165,0.17269747291628523
"Patrick Morrisey says Joe Manchin won't budge on Obamacare, ignoring bipartisan efforts",Patrick Morrisey cherry-picks Joe Manchin's votes on Trump Supreme Court pick Neil Gorsuch,patrick morrisey joe manchin wont budge obamacare ignoring bipartisan efforts ,patrick morrisey cherrypicks joe manchins votes trump supreme court pick neil gorsuch ,0.16,0.15789473684210525,53,0.0,N,N,0.20199309249791833,0.2868292703751504
"Barack Obama ad says women are paid ""77 cents on the dollar for doing the same work as men""","Barack Obama, in State of the Union, says women make 77 cents for every dollar a man earns",barack obama ad women paid 77 cents dollar work men ,barack obama state union women make seventyseven cents every dollar man earns ,0.3,0.29411764705882354,39,0.0,E,N,0.22028815056182968,0.2608061634066736
The Health Benefits Advisory Committee doesn't tell you what plan to buy,Republicans gloss over the details on a study on the employer mandate,health benefits advisory committee doesnt tell plan buy ,republicans gloss details study employer mandate ,0.0,0.0,44,0.0,N,ST,0.6029748160380572,1.0000000000000002
"'In states where beer is unregulated, the per capita production is significantly higher,' Sen. Kelli Stargel says",Sen. Kelli Stargel claims 'higher beer production and higher consumption go hand-in-hand',states beer unregulated per capita production significantly higher sen kelli stargel ,sen kelli stargel claims higher beer production higher consumption go handinhand ,0.43,0.4,57,0.1,N,ST,1.0000000000000002,0.1908740661302035
Professor says United Kingdom has unarmed police force and gun fatality rate 40 times lower than in U.S.,Rhode Island Sen. Dawson Hodgson says the state spends nearly as much on its legislature as it does on University of Rhode Island,professor united kingdom unarmed police force gun fatality rate forty times lower us ,rhode island sen dawson hodgson state spends nearly much legislature university rhode island ,0.0,0.0,71,0.0,N,N,0.12735952979479354,0.3753407941452982
Has Scott Walker changed his view on ethanol mandates?,"Scott Walker: UW tuition will be lower than ""just about any other campus""",scott walker changed view ethanol mandates ,scott walker uw tuition lower campus ,0.2,0.2,24,0.0,N,N,0.20199309249791833,0.5219696950015518
Republican Senate candidate Barry Hinckley says the “Buffett rule” would raise the equivalent of “a day and a half” of what the nation borrows every year.,U.S. Senate candidate Barry Hinckley says Sen. Sheldon Whitehouse will have added nearly $8 trillion to the national debt during his first term,republican senate candidate barry hinckley buffett rule would raise equivalent day half nation borrows every year ,us senate candidate barry hinckley sen sheldon whitehouse added nearly 8 trillion national debt first term ,0.15,0.14285714285714285,64,0.14285714285714285,N,N,0.29121941856368966,0.5934983239653103
Cokie Roberts: Two-thirds of minimum-wage earners are women,Vanden Heuvel: '1 out of 10 minimum wage workers today are teen age or a young person',cokie roberts twothirds minimumwage earners women ,vanden heuvel 1 ten minimum wage workers today teen age young person ,0.0,0.0,48,0.16666666666666666,N,N,0.0,0.26290969902260014
"On supporting 2015 right to work legislation, a Scott Walker reversal","Scott Walker claims credit for $816 in property tax savings over ""where things were headed""",supporting two thousand fifteen right work legislation scott walker reversal ,scott walker claims credit 816 property tax savings things headed ,0.11,0.1111111111111111,61,0.0,N,N,0.20199309249791833,0.6762401889207684
Donald Trump's baseless claims about the election being 'rigged',Donald Trump's Pants on Fire claim of 'large scale voter fraud',donald trumps baseless claims election rigged ,donald trumps pants fire claim large scale voter fraud ,0.16,0.15384615384615385,27,0.14285714285714285,E,N,0.26055567105626243,0.18764791026872885
Thune says Keystone XL pipeline has minimal impact on environment,Ralph Reed says alternatives to Keystone pipeline are worse for environment,thune keystone xl pipeline minimal impact environment ,ralph reed alternatives keystone pipeline worse environment ,0.28,0.2727272727272727,37,0.0,N,N,0.0,0.04416233594259862
Chris Wallace: Hillary Clinton defended Syria's Assad as a 'possible reformer',Marco Rubio says Hillary Clinton called Syria's Bashar al-Assad a 'reformer',chris wallace hillary clinton defended syrias assad possible reformer ,marco rubio hillary clinton called syrias bashar alassad reformer ,0.29,0.2857142857142857,27,0.0,E*,N,0.20199309249791836,0.2424638842085278
Barack Obama says White House budget would not add to the debt within a few years,"Tea Party Express' Amy Kremer says current tax revenues could cover interest, Medicare, Medicaid, Social Security",barack obama white house budget would add debt within years ,tea party express amy kremer current tax revenues could cover interest medicare medicaid social security ,0.0,0.0,78,0.0,N,N,0.1707761131901165,0.0
Obama radio ad says Ryan-Romney plan will end Medicare and replace it with a voucher,U.S. Sen. Robert Menendez says Paul Ryan’s budget would transform Medicare into a voucher system,obama radio ad ryanromney plan end medicare replace voucher ,us sen robert menendez paul ryans budget would transform medicare voucher system ,0.11,0.10526315789473684,53,0.0,E*,N,0.0,0.0
Mary Burke says Wisconsin is last in Midwest job growth under latest figures,Mary Burke says job growth has gotten worse every year of Scott Walker’s term,mary burke wisconsin last midwest job growth latest figures ,mary burke job growth gotten worse every year scott walkers term ,0.25,0.25,43,0.09090909090909091,N,ST,1.0000000000000002,0.5793545347233154
Gina Raimondo says she battled against the ill-fated 38 Studios deal from the beginning,Rhode Island Rep. Charlene Lima said Economic Development Commission head promised in writing that taxpayers would never have to pay for the bonds sold to 38 Studios,gina raimondo battled illfated thirtyeight studios deal beginning ,rhode island rep charlene lima economic development commission head promised writing taxpayers would never pay bonds sold thirtyeight studios ,0.09,0.08,110,0.0,N,N,0.0,0.10117859857468431
Barack Obama says Congress owns sequestration cuts,"Jeb Bush says Democrats 'responsible' for 'swift, mindless' cuts to defense spending",barack obama congress owns sequestration cuts ,jeb bush democrats responsible swift mindless cuts defense spending ,0.07,0.07142857142857142,52,0.0,N,N,0.0,0.6616989663218846
"Gubernatorial candidate Mayor Allan Fung says his administration created over 1,000 jobs in Cranston",Allan Fung says he had to pay a $100 hazardous materials fee to the state when he hired a campaign manager,gubernatorial candidate mayor allan fung administration created 1000 jobs cranston ,allan fung pay 100 hazardous materials fee state hired campaign manager ,0.11,0.10526315789473684,63,0.08333333333333333,N,N,0.3187840217537793,0.1273595297947935
Chamber of Commerce claims 20 million people will lose their current coverage because of health care reform,U.S. Chamber tells seniors that 20 million could lose coverage under the health care law,chamber commerce claims twenty million people lose current coverage health care reform ,us chamber tells seniors twenty million could lose coverage health care law ,0.41,0.4117647058823529,33,0.0,E,ST,0.38081653297711143,0.13912699369334094
Did the program that funded the Solyndra loan start under George W. Bush? David Plouffe says so,"Did Obama policies on Alaska, Solyndra and Keystone contribute to today's high gas prices?",program funded solyndra loan start george w bush david plouffe ,obama policies alaska solyndra keystone contribute todays high gas prices ,0.06,0.05263157894736842,54,0.0,N,N,0.0,0.0
"Senate rival Tommy Thompson backs ""Obamacare,"" says it can't be repealed, fellow GOP candidate Eric Hovde says",GOP Wisconsin Senate candidate Tommy Thompson says he never backed individual mandate,senate rival tommy thompson backs obamacare cant repealed fellow gop candidate eric hovde ,gop wisconsin senate candidate tommy thompson never backed individual mandate ,0.28,0.2777777777777778,67,0.0,N,N,0.0,0.08176804146599939
Did Scott Walker flip-flop on how budget shortfalls are measured??,"Despite deliberate actions, Scott Walker calls change to university mission a ""drafting error""",scott walker flipflop budget shortfalls measured ,despite deliberate actions scott walker calls change university mission drafting error ,0.14,0.13333333333333333,64,0.0,N,N,0.4112070550676187,0.4079306903717056
People's Majority: Sheldon Whitehouse got a secret briefing warning of the 2008 economic collapse,U.S. Senate candidate Barry Hinckley says incumbent Sen. Sheldon Whitehouse voted for a $525-billion tax hike on the middle class,peoples majority sheldon whitehouse got secret briefing warning two thousand eight economic collapse ,us senate candidate barry hinckley incumbent sen sheldon whitehouse voted 525billion tax hike middle class ,0.08,0.07692307692307693,87,0.0,N,N,0.13049436152984825,0.06487658725652556
Laura Ingraham: U.S. ambassador 'was dragged through the street' in Benghazi,"Hillary Clinton's State Department cut security in Libya before deadly terror attacks, Sen. Ron Johnson says",laura ingraham us ambassador dragged street benghazi ,hillary clintons state department cut security libya deadly terror attacks sen ron johnson ,0.0,0.0,67,0.0,N,N,0.20199309249791836,0.40326981746878143
Fox's Pirro: Obama set ISIS leader free in 2009,Actor James Woods: Obama ordered the release of Islamic State leader,foxs pirro obama set isis leader free two thousand nine ,actor james woods obama ordered release islamic state leader ,0.12,0.11764705882352941,46,0.0,E*,N,0.0,0.4167073239403889
Donald Trump says Hillary Clinton wants to let 500 percent more Syrians into the U.S.,Donald Trump again fails to screen out the falsehood in oft-repeated claim on Syrian refugees,donald trump hillary clinton wants let five hundred percent syrians us ,donald trump fails screen falsehood oftrepeated claim syrian refugees ,0.11,0.1111111111111111,43,0.0,ST,ST,0.6694188517266485,0.14002227032010647
Mostly True: Bernie Sanders' claim about U.S. voter turnout one of 'lowest on earth',"No, Donald Trump. You haven't broken the GOP voting record ‘by millions’ ... yet",mostly true bernie sanders claim us voter turnout one lowest earth ,donald trump havent broken gop voting record millions yet ,0.0,0.0,47,0.0,N,N,0.0,0.0
U.S. Rep. David Cicilline says women earn only 77 percent of what men earn in the same job,U.S. Rep. David Cicilline says the United States has been growing jobs for 24 months,us rep david cicilline women earn seventyseven percent men earn job ,us rep david cicilline united states growing jobs twentyfour months ,0.22,0.25,38,0.3076923076923077,N,N,0.5031026124151314,0.2802098668491703
Barack Obama says he's responsible for just 10 percent of budget shortfalls,Barack Obama says taxes on families are at their lowest point in 50 years,barack obama hes responsible ten percent budget shortfalls ,barack obama taxes families lowest point fifty years ,0.14,0.14285714285714285,34,0.1,N,N,0.33609692727625756,0.09009690756912406
Rick Scott opposed in-state tuition for DREAMers before he embraced it,Rick Scott says he supported in-state tuition for Dreamers while Charlie Crist opposed it,rick scott opposed instate tuition dreamers embraced ,rick scott supported instate tuition dreamers charlie crist opposed ,0.62,0.6,21,0.2222222222222222,N,E,1.0000000000000002,0.22178759671419054
Marco Rubio says Hillary Clinton called Syria's Bashar al-Assad a 'reformer',"In RNC speech, Chris Christie says Clinton called Assad a 'reformer,' a 'different kind of leader'",marco rubio hillary clinton called syrias bashar alassad reformer ,rnc speech chris christie clinton called assad reformer different kind leader ,0.18,0.17647058823529413,49,0.1111111111111111,E*,N,0.0,0.24469337041432895
Did Barack Obama vote for Religious Freedom Restoration Act with 'very same' wording as Indiana's?,Does Florida have a Religious Freedom Restoration Act like Indiana's?,barack obama vote religious freedom restoration act wording indianas ,florida religious freedom restoration act like indianas ,0.47,0.45454545454545453,21,0.25,N,N,0.0,0.6761463203881749
U.S. Rep. David Cicilline says Republican Brendan Doherty wants to raise Social Security eligibility age without regard for workers in physically demanding jobs,U.S. Rep. David Cicilline says the United States has been growing jobs for 24 months,us rep david cicilline republican brendan doherty wants raise social security eligibility age without regard workers physically demanding jobs ,us rep david cicilline united states growing jobs twentyfour months ,0.23,0.20833333333333334,95,0.3076923076923077,N,N,0.3187840217537793,0.11339276596929393
Bill Clinton: Zero net migration from Mexico since 2010,Martin O'Malley: Net migration from Mexico was 0 in 2014,bill clinton zero net migration mexico since two thousand ten ,martin omalley net migration mexico zero two thousand fourteen ,0.47,0.46153846153846156,24,0.14285714285714285,ST,N,0.0,0.05951439576030657
"No mandate, no universal care
",McCain voted against Bush's energy bill,mandate universal care ,mccain voted bushs energy bill ,0.0,0.0,21,0.0,N,N,0.4112070550676187,0.2746117864358066
"State Rep. John Edwards, quoting Rhode Island DOT, says 40 percent of Sakonnet Bridge traffic is from outside the state",Gov. Lincoln Chafee says Rhode Island would be first state in U.S. to adopt hybrid retirement plan for public employees,state rep john edwards quoting rhode island dot forty percent sakonnet bridge traffic outside state ,gov lincoln chafee rhode island would first state us adopt hybrid retirement plan public employees ,0.15,0.11538461538461539,72,0.0,N,N,0.14438355527738675,0.0
Rudy Giuliani wrongly says Hillary Clinton is for open borders,Trump: 'I’ve been proven right' about Clinton wanting open borders,rudy giuliani wrongly hillary clinton open borders ,trump ive proven right clinton wanting open borders ,0.25,0.25,29,0.0,ST,N,0.0,0.08399333195112163
Democratic Party chair Allison Tant attacks Gov. Rick Scott on teacher pay raises,Rick Scott says his K-12 education budget proposal is highest in Florida's history,democratic party chair allison tant attacks gov rick scott teacher pay raises ,rick scott k12 education budget proposal highest floridas history ,0.11,0.10526315789473684,60,0.0,N,N,0.0,0.08704446792504218
"Despite deliberate actions, Scott Walker calls change to university mission a ""drafting error""","Has PolitiFact rated Scott Walker the nation's ""most factually-challenged"" politician?",despite deliberate actions scott walker calls change university mission drafting error ,politifact rated scott walker nations factuallychallenged politician ,0.13,0.125,60,0.0,N,N,0.0,0.33863719785285057
Wisconsin Gov. Scott Walker says the state's jobs data is unreliable,Mary Burke says job growth has gotten worse every year of Scott Walker’s term,wisconsin gov scott walker states jobs data unreliable ,mary burke job growth gotten worse every year scott walkers term ,0.06,0.05555555555555555,49,0.0,N,N,0.0,0.5125640652466339
Did Scott Walker flip-flop on a immigration and a pathway to citizenship?,Scott Walker says he's got himself to thank for his tax bill going down,scott walker flipflop immigration pathway citizenship ,scott walker hes got thank tax bill going ,0.17,0.16666666666666666,32,0.0,N,N,0.33609692727625756,0.5358040788779596
Schultz claims that Landrieu got $1.8 million in BP PAC and employee contributions,Lee Fisher accuses Rob Portman of taking big contributions from ‘Big Oil’,schultz claims landrieu got 18 million bp pac employee contributions ,lee fisher accuses rob portman taking big contributions big oil ,0.05,0.05555555555555555,51,0.0,N,N,0.0,0.19806581389177932
